file,extension,path,item_uid_do_not_translate,lang_item_name,lang_item_definite_article,lang_item_indefinite_article,lang_item_demonstrative_article,lang_item_description
voidmarrowitem,.lang,items\lang\german\voidmarrowitem.lang,Voidmarrow,Schatten,der,ein,dieser,Ein wimmelnder Haufen schattiger Essenz. Es vermittelt dir ein unbehagliches Gefühl.
voleitem,.lang,items\lang\german\voleitem.lang,Vole,Wühlmaus,die,eine,diese,Sieht ein bisschen wie ein Hamster aus.
wallcrystalsfurnitureitem,.lang,items\lang\german\wallcrystalsfurnitureitem.lang,Wall Crystals Furniture,Wandkristalle,die,eine,diese,"Rosa-weiße Quarzkristalle, die sich an senkrechten Oberflächen wie den Wänden deiner Höhle festhalten können."
weaselitem,.lang,items\lang\german\weaselitem.lang,Weasel,Wiesel,das,ein,dieses,"Eine schlanke Kreatur mit kleinen, runden Ohren."
whiskersaccessoryitem,.lang,items\lang\german\whiskersaccessoryitem.lang,Whiskers Accessory,Schnurrhaare,die,ein,diese,"Die meisten Katzen haben Schnurrhaare, aber diese sind dicker und deutlicher ausgeprägt."
whitebuttonitem,.lang,items\lang\german\whitebuttonitem.lang,White Button,Weißer Champignon,der,ein,dieser,Ein zierlicher Weißkappenpilz mit erdigem Geschmack.
whitecavecricketitem,.lang,items\lang\german\whitecavecricketitem.lang,White Cave Cricket,Weiße Höhlenschrecke,die,eine,diese,Eine kleine Kreatur mit dunklen Augen und einem durchsichtigen Körper. Sie versammeln sich oft unter Steinen.
whitefireflyitem,.lang,items\lang\german\whitefireflyitem.lang,White Firefly,Weißes Glühwürmchen,das,ein,dieses,"Ein leuchtender Sommerkäfer, der weißes Licht ausstrahlt."
whitefloweraccessoryitem,.lang,items\lang\german\whitefloweraccessoryitem.lang,White Flower Accessory,Weiße Blume,die,eine,diese,Eine schöne weiße Blüte als Kopfschmuck.
whitespikecollaraccessoryitem,.lang,items\lang\german\whitespikecollaraccessoryitem.lang,White Spike Collar Accessory,Weißes Stachelhalsband,das,ein,dieses,"Ein weißes Lederband, besetzt mit kleinen schwarzen Stacheln. Sie sehen spitz aus!"
whorlitem,.lang,items\lang\german\whorlitem.lang,Whorl,Wirbel,der,ein,dieser,Diese harte Schale hat ein Spiralmuster.
wildwoodrecorditem,.lang,items\lang\german\wildwoodrecorditem.lang,Wildwood Record,Wildwood,der,ein,dieser,"Eine Schallplatte, die du auf dem Plattenspieler in deiner Höhle abspielen kannst. Dieser Titel ist eine abenteuerliche Melodie."
winter1recorditem,.lang,items\lang\german\winter1recorditem.lang,Winter 1 Record,Winter 1,der,ein,dieser,"Eine Schallplatte, die du auf dem Plattenspieler in deiner Höhle abspielen kannst. Dieser Titel ist eine beruhigende Wintermelodie."
winter2recorditem,.lang,items\lang\german\winter2recorditem.lang,Winter 2 Record,Winter 2,der,ein,dieser,"Eine Schallplatte, die du auf dem Plattenspieler in deiner Höhle abspielen kannst. Dieser Titel ist eine kühle Wintermelodie."
winter3recorditem,.lang,items\lang\german\winter3recorditem.lang,Winter 3 Record,Winter 3,der,ein,dieser,"Eine Schallplatte, die du auf dem Plattenspieler in deiner Höhle abspielen kannst. Dieser Titel ist eine friedliche Wintermelodie."
winterfestivalrecorditem,.lang,items\lang\german\winterfestivalrecorditem.lang,Winter Festival Record,Winterfest,das,ein,dieses,"Eine Schallplatte, die du auf dem Plattenspieler in deiner Höhle abspielen kannst. Dieser Titel ist eine Winterparty-Melodie."
winterlightsfurnitureitem,.lang,items\lang\german\winterlightsfurnitureitem.lang,Winter Lights Furniture,Winterlichter,die,eine,diese,"Mehrfarbige Glühbirnen, an einer festlichen Schnur aufgereiht."
wirycurioitem,.lang,items\lang\german\wirycurioitem.lang,Wiry Curio,Drahtige Kuriosität,die,eine,diese,Ein verlockendes langes Stück eines zwirnartigen Materials.
wolfspideritem,.lang,items\lang\german\wolfspideritem.lang,Wolf Spider,Wolfsspinne,die,eine,diese,"Eine beängstigende Kreatur mit einem speziellen Gift, das deine Bewegungen verlangsamen kann."
woodencurioitem,.lang,items\lang\german\woodencurioitem.lang,Wooden Curio,Hölzerne Kuriosität,die,eine,diese,"Ein flacher Holzstab, an einem Ende leicht gebeizt."
woolycurioitem,.lang,items\lang\german\woolycurioitem.lang,Wooly Curio,Wollige Kuriosität,die,eine,diese,Ein sehr weicher Beutel aus Stoff.
wovenrugfurnitureitem,.lang,items\lang\german\wovenrugfurnitureitem.lang,Woven Rug Furniture,Gewebter Teppich,der,ein,dieser,"Irgendeine Katze hat viel Zeit damit verbracht, das dicke Material sorgfältig zu weben, um diesen kleinen Teppich herzustellen!"
wrenitem,.lang,items\lang\german\wrenitem.lang,Wren,Zaunkönig,der,ein,dieser,Ein kleiner brauner Vogel.
wretchedtalismanitem,.lang,items\lang\german\wretchedtalismanitem.lang,Wretched Talisman,Elendiger Talisman,der,ein,dieser,"Ein verfluchtes Amulett, das vom Nichts flüstert. Benutze es, um eine Invasionsarmee von Schattenkatzen zu beschwören. Wenn du sie alle besiegst, wirst du belohnt."
wretchedtalismanrecipeitem,.lang,items\lang\german\wretchedtalismanrecipeitem.lang,Wretched Talisman Recipe,Rezept für den elendigen Talisman,das,ein,dieses,"Ein verfluchtes Amulett, das vom Nichts flüstert. Benutze es, um eine Invasionsarmee von Schattenkatzen zu beschwören. Wenn du sie alle besiegst, wirst du belohnt."
yellowfireflyitem,.lang,items\lang\german\yellowfireflyitem.lang,Yellow Firefly,Gelbes Glühwürmchen,das,ein,dieses,"Ein heller Sommerkäfer, der gelbes Licht ausstrahlt."
yellowladybugitem,.lang,items\lang\german\yellowladybugitem.lang,Yellow Ladybug,Gelber Marienkäfer,der,ein,dieser,Ein auffälliger kleiner Käfer mit schwarzen Punkten.
