file,extension,path,lang_wedding_venues_name,lang_wedding_venues_description
1festivalplaza,.lang,wedding_venues\lang\english\1festivalplaza.lang,Festival Plaza,A comfortable outdoor venue with plenty of space for guests.
2beach,.lang,wedding_venues\lang\english\2beach.lang,Beach West,A dreamy place to tie the knot while soaking up the sun.
3temple,.lang,wedding_venues\lang\english\3temple.lang,Temple,Long tradition favors this sacred space for a wedding.
4meadow,.lang,wedding_venues\lang\english\4meadow.lang,Meadow,A flower-covered field near a gentle river.
5birchlake,.lang,wedding_venues\lang\english\5birchlake.lang,Birch Lake,A birch forest with a lake in the center.
