file,extension,path,lang_wedding_venues_name,lang_wedding_venues_description
1festivalplaza,.lang,wedding_venues\lang\german\1festivalplaza.lang,Festplatz,Ein gemütlicher Veranstaltungsort im Freien mit viel Platz für die Gäste.
2beach,.lang,wedding_venues\lang\german\2beach.lang,Westlicher Strand,"Ein traumhafter Ort, um bei Sonnenschein den Bund fürs Leben zu schließen."
3temple,.lang,wedding_venues\lang\german\3temple.lang,Tempel,Für eine Hochzeit hat dieser heilige Ort eine lange Tradition.
4meadow,.lang,wedding_venues\lang\german\4meadow.lang,Wiese,Ein blumenbedecktes Feld in der Nähe eines sanften Flusses.
5birchlake,.lang,wedding_venues\lang\german\5birchlake.lang,Birkensee,Ein Birkenwald mit einem See in der Mitte.
